{
  "params": {
    "grid_w": 20,
    "grid_h": 20
  },
  "obstacles": [
    { "id": 1, "type": "rect", "x": 4.8,  "y": 15.2, "w": 10.4, "h": 2.6 },
    { "id": 2, "type": "rect", "x": 4.8,  "y": 7.9,  "w": 4.3,  "h": 4.2 },
    { "id": 3, "type": "rect", "x": 11.1, "y": 7.9,  "w": 4.3,  "h": 4.2 },
    { "id": 4, "type": "rect", "x": 4.8,  "y": 2.2,  "w": 10.2, "h": 2.0 }
  ],
  "agents": [
    { "id": 1, "name": "a1", "start": [10.1, 1.3],  "waypoint": [10.1, 10.0], "goal": [10.1, 18.6], "route_waypoints": [], "path_override": null },
    { "id": 2, "name": "a2", "start": [18.3, 1.8],  "waypoint": [1.8, 14.0],  "goal": [1.8, 18.2],  "route_waypoints": [], "path_override": null },
    { "id": 3, "name": "a3", "start": [1.8, 1.8],   "waypoint": [18.1, 5.9],  "goal": [18.3, 18.2], "route_waypoints": [], "path_override": null }
  ],
  "dependencies": []
}
